{
  "schemaVersion": 1,
  "id": "c.array.001",
  "version": 1,
  "officialYear": 2026,
  "domainId": "programming-language",
  "conceptIds": ["c-array"],
  "prerequisites": ["c-control-flow"],
  "objective": "C 배열의 0부터 시작하는 인덱스를 이용해 원소 값을 찾는다.",
  "knowledgeType": "code",
  "prompt": "다음 C 배열에서 scores[2]의 값은?\n\nint scores[4] = {7, 11, 13, 17};",
  "answer": "13",
  "explanation": "C 배열의 인덱스는 0부터 시작하므로 scores[2]는 세 번째 원소인 13이다.",
  "grading": {
    "strategy": "exact",
    "acceptedAnswers": ["13"]
  },
  "hints": {
    "conceptClue": "C 배열의 첫 번째 원소 인덱스가 몇인지 떠올려 보세요.",
    "structureHint": "scores[0]부터 차례대로 원소를 대응해 보세요.",
    "specificHint": "scores[0]은 7, scores[1]은 11, scores[2]는 13입니다."
  },
  "difficulty": 1,
  "estimatedMinutes": 4,
  "author": "doo-study",
  "reviewStatus": "reviewed",
  "review": {
    "reviewer": "codex-c1-review",
    "reviewedAt": "2026-09-04T20:18:00+09:00",
    "reviewedVersion": 1,
    "checklist": {
      "answer": true,
      "explanation": true,
      "scope": true,
      "acceptedAnswers": true,
      "difficulty": true
    }
  },
  "rights": {
    "source": "2026 Q-Net 정보처리기사 출제기준의 프로그래밍 언어 활용 범위",
    "license": "original",
    "notes": "공식 범위를 근거로 직접 작성한 독자 문항"
  },
  "changeReason": "C1 배열 개념의 인덱스 추적 콘텐츠 확장",
  "memoryInheritance": "reset"
}
