{
  "schemaVersion": 1,
  "id": "c.pointer.002",
  "version": 1,
  "officialYear": 2026,
  "domainId": "programming-language",
  "conceptIds": ["c-pointer"],
  "prerequisites": ["c-array"],
  "objective": "배열을 가리키는 포인터의 이동과 역참조 결과를 추적한다.",
  "knowledgeType": "code",
  "prompt": "다음 C 코드 실행 뒤 *p의 값은?\n\nint data[3] = {4, 7, 10};\nint *p = data;\np++;",
  "answer": "7",
  "explanation": "배열 이름 data는 첫 원소의 주소로 사용되고 p++는 다음 int 원소를 가리키게 한다. 따라서 p는 data[1]을 가리키며 *p는 7이다.",
  "grading": {
    "strategy": "exact",
    "acceptedAnswers": ["7"]
  },
  "hints": {
    "conceptClue": "배열 이름이 식에서 첫 번째 원소의 주소로 사용되는 경우를 떠올려 보세요.",
    "structureHint": "p는 처음 data[0]을 가리키고 p++ 뒤에는 다음 원소를 가리킵니다.",
    "specificHint": "p++ 뒤 p가 가리키는 원소는 data[1]입니다."
  },
  "difficulty": 2,
  "estimatedMinutes": 5,
  "author": "doo-study",
  "reviewStatus": "reviewed",
  "review": {
    "reviewer": "codex-c1-review",
    "reviewedAt": "2026-09-04T20:18:00+09:00",
    "reviewedVersion": 1,
    "checklist": {
      "answer": true,
      "explanation": true,
      "scope": true,
      "acceptedAnswers": true,
      "difficulty": true
    }
  },
  "rights": {
    "source": "2026 Q-Net 정보처리기사 출제기준의 프로그래밍 언어 활용 범위",
    "license": "original",
    "notes": "공식 범위를 근거로 직접 작성한 독자 문항"
  },
  "changeReason": "C1 포인터 개념의 배열 포인터 상태 추적 콘텐츠 확장",
  "memoryInheritance": "reset"
}
