{
  "schemaVersion": 1,
  "id": "sql.group.001",
  "version": 1,
  "officialYear": 2026,
  "domainId": "sql",
  "conceptIds": ["sql-group"],
  "prerequisites": ["sql-where"],
  "objective": "집계 전에 같은 값을 가진 행을 묶는 GROUP BY 절의 역할을 회상한다.",
  "knowledgeType": "sql",
  "prompt": "SQL에서 같은 값을 가진 행들을 그룹으로 묶어 집계할 때 사용하는 절은 무엇인가?",
  "answer": "GROUP BY 절",
  "explanation": "GROUP BY 절은 지정한 열의 값이 같은 행들을 그룹으로 묶어 COUNT, SUM 같은 집계 함수와 함께 사용할 수 있게 한다.",
  "grading": {
    "strategy": "exact",
    "acceptedAnswers": ["GROUP BY", "GROUP BY 절"]
  },
  "hints": {
    "conceptClue": "여러 행을 공통 값 기준으로 묶는 절을 떠올려 보세요.",
    "structureHint": "SELECT ... FROM ... GROUP ___ 열 형태의 두 단어 절입니다.",
    "specificHint": "정답 키워드는 GROUP BY입니다."
  },
  "difficulty": 1,
  "estimatedMinutes": 4,
  "author": "doo-study",
  "reviewStatus": "reviewed",
  "review": {
    "reviewer": "codex-l1-review",
    "reviewedAt": "2026-09-04T19:44:00+09:00",
    "reviewedVersion": 1,
    "checklist": {
      "answer": true,
      "explanation": true,
      "scope": true,
      "acceptedAnswers": true,
      "difficulty": true
    }
  },
  "rights": {
    "source": "2026 Q-Net 정보처리기사 출제기준의 SQL 응용 범위",
    "license": "original",
    "notes": "공식 범위를 근거로 직접 작성한 독자 문항"
  },
  "changeReason": "SQL GROUP BY 개념의 회상 콘텐츠 확장",
  "memoryInheritance": "reset"
}
